{
  "schema_version": "1.0.0",
  "generator": {
    "name": "called-it",
    "version": "1.0.0",
    "commit": "6bfa325"
  },
  "generated_at": "2026-10-21T00:16:26.308752Z",
  "instrument": {
    "country": "US",
    "market": "NASDAQ",
    "ticker": "AAOI"
  },
  "source": "google_sheets_googfinance",
  "updated_at": "2026-10-20",
  "bars": [
    {
      "date": "2026-07-29",
      "open": 88.19,
      "high": 88.28,
      "low": 76.01,
      "close": 76.52,
      "volume": 12204269.0
    },
    {
      "date": "2026-07-30",
      "open": 83.35,
      "high": 90.68,
      "low": 82.8,
      "close": 90.11,
      "volume": 10949180.0
    },
    {
      "date": "2026-07-31",
      "open": 100.1,
      "high": 103.2,
      "low": 91.03,
      "close": 94.32,
      "volume": 9739870.0
    },
    {
      "date": "2026-08-03",
      "open": 89.8,
      "high": 110.95,
      "low": 88.13,
      "close": 110.21,
      "volume": 12055508.0
    },
    {
      "date": "2026-08-04",
      "open": 128.57,
      "high": 136.27,
      "low": 123.5,
      "close": 131.63,
      "volume": 21013706.0
    },
    {
      "date": "2026-08-05",
      "open": 128.45,
      "high": 140.34,
      "low": 128.0,
      "close": 128.56,
      "volume": 12480209.0
    },
    {
      "date": "2026-08-06",
      "open": 121.38,
      "high": 134.29,
      "low": 118.88,
      "close": 124.22,
      "volume": 15377237.0
    },
    {
      "date": "2026-08-07",
      "open": 142.48,
      "high": 149.35,
      "low": 130.5,
      "close": 135.63,
      "volume": 24102427.0
    },
    {
      "date": "2026-08-10",
      "open": 141.72,
      "high": 148.9,
      "low": 128.8,
      "close": 132.81,
      "volume": 18508694.0
    },
    {
      "date": "2026-08-11",
      "open": 133.97,
      "high": 137.23,
      "low": 127.5,
      "close": 134.33,
      "volume": 9211221.0
    },
    {
      "date": "2026-08-12",
      "open": 141.7,
      "high": 142.8,
      "low": 129.09,
      "close": 138.08,
      "volume": 13189166.0
    },
    {
      "date": "2026-08-13",
      "open": 135.84,
      "high": 144.52,
      "low": 129.67,
      "close": 130.08,
      "volume": 10700688.0
    },
    {
      "date": "2026-08-14",
      "open": 130.39,
      "high": 153.39,
      "low": 130.34,
      "close": 150.28,
      "volume": 18774955.0
    },
    {
      "date": "2026-08-17",
      "open": 152.64,
      "high": 160.99,
      "low": 147.35,
      "close": 154.89,
      "volume": 12904146.0
    },
    {
      "date": "2026-08-18",
      "open": 146.2,
      "high": 151.41,
      "low": 131.22,
      "close": 131.41,
      "volume": 14651488.0
    },
    {
      "date": "2026-08-19",
      "open": 135.85,
      "high": 138.56,
      "low": 121.5,
      "close": 122.19,
      "volume": 12346621.0
    },
    {
      "date": "2026-08-20",
      "open": 121.92,
      "high": 130.49,
      "low": 118.6,
      "close": 129.1,
      "volume": 9518767.0
    },
    {
      "date": "2026-08-21",
      "open": 129.37,
      "high": 133.72,
      "low": 121.89,
      "close": 124.82,
      "volume": 9748192.0
    },
    {
      "date": "2026-08-24",
      "open": 109.13,
      "high": 112.46,
      "low": 102.1,
      "close": 107.63,
      "volume": 15016540.0
    },
    {
      "date": "2026-08-25",
      "open": 111.78,
      "high": 115.08,
      "low": 110.24,
      "close": 113.15,
      "volume": 6735547.0
    },
    {
      "date": "2026-08-26",
      "open": 110.59,
      "high": 114.21,
      "low": 110.01,
      "close": 113.76,
      "volume": 4878841.0
    },
    {
      "date": "2026-08-27",
      "open": 117.03,
      "high": 118.9,
      "low": 111.3,
      "close": 113.28,
      "volume": 6254055.0
    },
    {
      "date": "2026-08-28",
      "open": 110.46,
      "high": 110.9,
      "low": 105.15,
      "close": 106.23,
      "volume": 5716919.0
    },
    {
      "date": "2026-08-31",
      "open": 107.52,
      "high": 108.67,
      "low": 104.06,
      "close": 107.69,
      "volume": 4609495.0
    },
    {
      "date": "2026-09-01",
      "open": 104.45,
      "high": 105.74,
      "low": 101.23,
      "close": 103.39,
      "volume": 4893769.0
    },
    {
      "date": "2026-09-02",
      "open": 102.09,
      "high": 104.74,
      "low": 100.8,
      "close": 103.13,
      "volume": 4092319.0
    },
    {
      "date": "2026-09-03",
      "open": 101.9,
      "high": 103.14,
      "low": 96.96,
      "close": 100.38,
      "volume": 5917986.0
    },
    {
      "date": "2026-09-04",
      "open": 101.91,
      "high": 106.56,
      "low": 100.54,
      "close": 105.53,
      "volume": 6840211.0
    },
    {
      "date": "2026-09-08",
      "open": 108.39,
      "high": 116.9,
      "low": 107.8,
      "close": 111.55,
      "volume": 12081150.0
    },
    {
      "date": "2026-09-09",
      "open": 110.78,
      "high": 113.64,
      "low": 107.62,
      "close": 107.93,
      "volume": 5977405.0
    },
    {
      "date": "2026-09-10",
      "open": 104.5,
      "high": 109.78,
      "low": 102.99,
      "close": 103.29,
      "volume": 5703942.0
    },
    {
      "date": "2026-09-11",
      "open": 104.51,
      "high": 108.67,
      "low": 104.08,
      "close": 105.36,
      "volume": 5001360.0
    },
    {
      "date": "2026-09-14",
      "open": 96.77,
      "high": 101.13,
      "low": 95.67,
      "close": 95.76,
      "volume": 8519369.0
    },
    {
      "date": "2026-09-15",
      "open": 96.99,
      "high": 99.79,
      "low": 95.08,
      "close": 95.29,
      "volume": 4598478.0
    },
    {
      "date": "2026-09-16",
      "open": 98.2,
      "high": 99.6,
      "low": 94.0,
      "close": 96.74,
      "volume": 7101162.0
    },
    {
      "date": "2026-09-17",
      "open": 100.73,
      "high": 102.35,
      "low": 96.36,
      "close": 98.06,
      "volume": 7819196.0
    },
    {
      "date": "2026-09-18",
      "open": 101.07,
      "high": 105.44,
      "low": 98.52,
      "close": 105.17,
      "volume": 9920293.0
    },
    {
      "date": "2026-09-21",
      "open": 108.2,
      "high": 109.73,
      "low": 104.92,
      "close": 108.67,
      "volume": 8161283.0
    },
    {
      "date": "2026-09-22",
      "open": 106.93,
      "high": 110.74,
      "low": 103.9,
      "close": 107.0,
      "volume": 7480508.0
    },
    {
      "date": "2026-09-23",
      "open": 106.6,
      "high": 107.32,
      "low": 100.42,
      "close": 101.06,
      "volume": 6601676.0
    },
    {
      "date": "2026-09-24",
      "open": 98.93,
      "high": 103.58,
      "low": 97.59,
      "close": 101.03,
      "volume": 5551425.0
    },
    {
      "date": "2026-09-25",
      "open": 101.71,
      "high": 105.03,
      "low": 99.97,
      "close": 101.4,
      "volume": 5510958.0
    },
    {
      "date": "2026-09-28",
      "open": 100.09,
      "high": 102.43,
      "low": 93.62,
      "close": 96.82,
      "volume": 8195644.0
    },
    {
      "date": "2026-09-29",
      "open": 98.77,
      "high": 103.83,
      "low": 97.43,
      "close": 100.67,
      "volume": 7288123.0
    },
    {
      "date": "2026-09-30",
      "open": 101.9,
      "high": 104.25,
      "low": 96.41,
      "close": 99.26,
      "volume": 5827340.0
    },
    {
      "date": "2026-10-01",
      "open": 99.67,
      "high": 108.28,
      "low": 97.77,
      "close": 107.32,
      "volume": 11307718.0
    },
    {
      "date": "2026-10-02",
      "open": 110.25,
      "high": 117.7,
      "low": 106.32,
      "close": 115.59,
      "volume": 11066147.0
    },
    {
      "date": "2026-10-05",
      "open": 118.5,
      "high": 121.92,
      "low": 112.8,
      "close": 121.57,
      "volume": 9354093.0
    },
    {
      "date": "2026-10-06",
      "open": 126.0,
      "high": 131.15,
      "low": 124.3,
      "close": 130.16,
      "volume": 12525183.0
    },
    {
      "date": "2026-10-07",
      "open": 126.12,
      "high": 127.89,
      "low": 119.73,
      "close": 122.54,
      "volume": 10765724.0
    },
    {
      "date": "2026-10-08",
      "open": 117.44,
      "high": 119.91,
      "low": 104.88,
      "close": 105.9,
      "volume": 19419305.0
    },
    {
      "date": "2026-10-09",
      "open": 113.0,
      "high": 117.16,
      "low": 108.62,
      "close": 109.64,
      "volume": 14512494.0
    },
    {
      "date": "2026-10-12",
      "open": 106.2,
      "high": 106.41,
      "low": 99.22,
      "close": 100.68,
      "volume": 11030865.0
    },
    {
      "date": "2026-10-13",
      "open": 97.44,
      "high": 99.77,
      "low": 95.08,
      "close": 97.78,
      "volume": 10830634.0
    },
    {
      "date": "2026-10-14",
      "open": 94.96,
      "high": 96.14,
      "low": 85.76,
      "close": 86.22,
      "volume": 14925814.0
    },
    {
      "date": "2026-10-15",
      "open": 80.91,
      "high": 85.02,
      "low": 76.21,
      "close": 83.73,
      "volume": 17787679.0
    },
    {
      "date": "2026-10-16",
      "open": 83.31,
      "high": 83.44,
      "low": 75.43,
      "close": 75.57,
      "volume": 14151995.0
    },
    {
      "date": "2026-10-19",
      "open": 80.0,
      "high": 80.47,
      "low": 75.62,
      "close": 78.2,
      "volume": 11313150.0
    },
    {
      "date": "2026-10-20",
      "open": 75.0,
      "high": 79.19,
      "low": 73.05,
      "close": 76.74,
      "volume": 8744112.0
    }
  ],
  "finance_symbol": "NASDAQ:AAOI"
}
