{
  "schema_version": "1.0.0",
  "generator": {
    "name": "called-it",
    "version": "1.0.0",
    "commit": "0a2bf24"
  },
  "generated_at": "2026-10-27T06:04:10.875229Z",
  "instrument": {
    "country": "US",
    "market": "NASDAQ",
    "ticker": "SOXL"
  },
  "source": "google_sheets_googfinance",
  "updated_at": "2026-10-26",
  "bars": [
    {
      "date": "2026-10-13",
      "open": 118.42,
      "high": 127.92,
      "low": 115.84,
      "close": 127.57,
      "volume": 79220160.0
    },
    {
      "date": "2026-10-14",
      "open": 119.02,
      "high": 120.9,
      "low": 109.0,
      "close": 110.54,
      "volume": 107400735.0
    },
    {
      "date": "2026-10-15",
      "open": 98.35,
      "high": 108.8,
      "low": 95.23,
      "close": 107.35,
      "volume": 139897322.0
    },
    {
      "date": "2026-10-16",
      "open": 101.19,
      "high": 103.93,
      "low": 93.45,
      "close": 93.67,
      "volume": 115242058.0
    },
    {
      "date": "2026-10-19",
      "open": 103.95,
      "high": 104.98,
      "low": 97.8,
      "close": 98.65,
      "volume": 95625915.0
    },
    {
      "date": "2026-10-20",
      "open": 94.52,
      "high": 102.62,
      "low": 91.35,
      "close": 97.55,
      "volume": 100094114.0
    },
    {
      "date": "2026-10-21",
      "open": 102.86,
      "high": 106.13,
      "low": 99.31,
      "close": 103.24,
      "volume": 79757022.0
    },
    {
      "date": "2026-10-22",
      "open": 90.59,
      "high": 93.4,
      "low": 80.22,
      "close": 82.11,
      "volume": 180752908.0
    },
    {
      "date": "2026-10-23",
      "open": 81.64,
      "high": 87.61,
      "low": 80.83,
      "close": 83.56,
      "volume": 92699416.0
    },
    {
      "date": "2026-10-26",
      "open": 85.88,
      "high": 93.15,
      "low": 84.22,
      "close": 90.5,
      "volume": 101281475.0
    }
  ],
  "finance_symbol": "NYSEARCA:SOXL"
}
