{
  "schema_version": "1.0.0",
  "generator": {
    "name": "called-it",
    "version": "1.0.0",
    "commit": "00948a7"
  },
  "generated_at": "2026-07-06T23:01:12.741322Z",
  "instrument": {
    "country": "US",
    "market": "NASDAQ",
    "ticker": "QCOM"
  },
  "source": "google_sheets_googfinance",
  "updated_at": "2026-07-06",
  "bars": [
    {
      "date": "2026-06-09",
      "open": 216.46,
      "high": 219.64,
      "low": 192.67,
      "close": 205.42,
      "volume": 29906287.0
    },
    {
      "date": "2026-06-10",
      "open": 199.46,
      "high": 204.9,
      "low": 190.1,
      "close": 191.2,
      "volume": 18426634.0
    },
    {
      "date": "2026-06-11",
      "open": 190.92,
      "high": 203.84,
      "low": 190.75,
      "close": 202.96,
      "volume": 18933065.0
    },
    {
      "date": "2026-06-12",
      "open": 201.85,
      "high": 215.01,
      "low": 200.1,
      "close": 211.72,
      "volume": 14134862.0
    },
    {
      "date": "2026-06-15",
      "open": 219.77,
      "high": 226.46,
      "low": 216.28,
      "close": 220.81,
      "volume": 13993753.0
    },
    {
      "date": "2026-06-16",
      "open": 225.83,
      "high": 231.19,
      "low": 213.8,
      "close": 214.07,
      "volume": 19629556.0
    },
    {
      "date": "2026-06-17",
      "open": 219.04,
      "high": 221.32,
      "low": 212.68,
      "close": 212.97,
      "volume": 11955848.0
    },
    {
      "date": "2026-06-18",
      "open": 220.71,
      "high": 229.42,
      "low": 214.73,
      "close": 226.11,
      "volume": 47081544.0
    },
    {
      "date": "2026-06-22",
      "open": 222.93,
      "high": 233.44,
      "low": 215.5,
      "close": 221.9,
      "volume": 18203388.0
    },
    {
      "date": "2026-06-23",
      "open": 207.34,
      "high": 209.18,
      "low": 198.44,
      "close": 204.13,
      "volume": 23781891.0
    },
    {
      "date": "2026-06-24",
      "open": 202.57,
      "high": 202.97,
      "low": 191.02,
      "close": 197.41,
      "volume": 25519633.0
    },
    {
      "date": "2026-06-25",
      "open": 219.43,
      "high": 219.43,
      "low": 199.82,
      "close": 204.9,
      "volume": 34879266.0
    },
    {
      "date": "2026-06-26",
      "open": 201.7,
      "high": 208.86,
      "low": 186.18,
      "close": 189.39,
      "volume": 36402412.0
    },
    {
      "date": "2026-06-29",
      "open": 193.03,
      "high": 194.59,
      "low": 183.58,
      "close": 188.72,
      "volume": 21599518.0
    },
    {
      "date": "2026-06-30",
      "open": 188.99,
      "high": 193.5,
      "low": 183.5,
      "close": 184.79,
      "volume": 21497271.0
    },
    {
      "date": "2026-07-01",
      "open": 183.59,
      "high": 190.99,
      "low": 181.6,
      "close": 181.92,
      "volume": 22650679.0
    },
    {
      "date": "2026-07-02",
      "open": 182.17,
      "high": 185.8,
      "low": 172.12,
      "close": 176.25,
      "volume": 18467345.0
    },
    {
      "date": "2026-07-06",
      "open": 178.13,
      "high": 188.67,
      "low": 177.1,
      "close": 186.48,
      "volume": 15345287.0
    }
  ],
  "finance_symbol": "NASDAQ:QCOM"
}
