{
  "schema_version": "1.0.0",
  "generator": {
    "name": "called-it",
    "version": "1.0.0",
    "commit": "29a6471"
  },
  "generated_at": "2026-08-06T13:09:38.735276Z",
  "instrument": {
    "country": "KR",
    "market": "KOSPI",
    "ticker": "005930"
  },
  "source": "google_sheets_googfinance",
  "updated_at": "2026-08-06",
  "bars": [
    {
      "date": "2026-07-24",
      "open": 266000.0,
      "high": 266500.0,
      "low": 247000.0,
      "close": 249500.0,
      "volume": 26175580.0
    },
    {
      "date": "2026-07-27",
      "open": 257000.0,
      "high": 258500.0,
      "low": 246000.0,
      "close": 254000.0,
      "volume": 23296044.0
    },
    {
      "date": "2026-07-28",
      "open": 238500.0,
      "high": 240000.0,
      "low": 218500.0,
      "close": 220000.0,
      "volume": 41639623.0
    },
    {
      "date": "2026-07-29",
      "open": 226500.0,
      "high": 234000.0,
      "low": 189200.0,
      "close": 208500.0,
      "volume": 65555523.0
    },
    {
      "date": "2026-07-30",
      "open": 214000.0,
      "high": 226000.0,
      "low": 202000.0,
      "close": 207000.0,
      "volume": 46694193.0
    },
    {
      "date": "2026-07-31",
      "open": 257000.0,
      "high": 267000.0,
      "low": 243000.0,
      "close": 262500.0,
      "volume": 58478873.0
    },
    {
      "date": "2026-08-03",
      "open": 248000.0,
      "high": 249500.0,
      "low": 238000.0,
      "close": 239500.0,
      "volume": 27825493.0
    },
    {
      "date": "2026-08-04",
      "open": 244500.0,
      "high": 244500.0,
      "low": 228000.0,
      "close": 240000.0,
      "volume": 29433821.0
    },
    {
      "date": "2026-08-05",
      "open": 254000.0,
      "high": 254500.0,
      "low": 244000.0,
      "close": 246000.0,
      "volume": 22577128.0
    },
    {
      "date": "2026-08-06",
      "open": 241500.0,
      "high": 246000.0,
      "low": 228000.0,
      "close": 230500.0,
      "volume": 26101823.0
    }
  ],
  "finance_symbol": "KRX:005930"
}
