{
  "schema_version": "1.0.0",
  "generator": {
    "name": "called-it",
    "version": "1.0.0",
    "commit": "cacc120"
  },
  "generated_at": "2026-07-03T11:08:47.187324Z",
  "instrument": {
    "country": "KR",
    "market": "KOSDAQ",
    "ticker": "277810"
  },
  "source": "google_sheets_googfinance",
  "updated_at": "2026-07-02",
  "bars": [
    {
      "date": "2026-06-04",
      "open": 739000.0,
      "high": 753000.0,
      "low": 711000.0,
      "close": 714000.0,
      "volume": 130937.0
    },
    {
      "date": "2026-06-05",
      "open": 690000.0,
      "high": 697000.0,
      "low": 655000.0,
      "close": 668000.0,
      "volume": 136427.0
    },
    {
      "date": "2026-06-08",
      "open": 612000.0,
      "high": 648000.0,
      "low": 605000.0,
      "close": 610000.0,
      "volume": 146380.0
    },
    {
      "date": "2026-06-09",
      "open": 625000.0,
      "high": 649000.0,
      "low": 604000.0,
      "close": 623000.0,
      "volume": 123696.0
    },
    {
      "date": "2026-06-10",
      "open": 618000.0,
      "high": 644000.0,
      "low": 582000.0,
      "close": 598000.0,
      "volume": 113721.0
    },
    {
      "date": "2026-06-11",
      "open": 585000.0,
      "high": 605000.0,
      "low": 555000.0,
      "close": 605000.0,
      "volume": 172715.0
    },
    {
      "date": "2026-06-12",
      "open": 630000.0,
      "high": 683000.0,
      "low": 620000.0,
      "close": 624000.0,
      "volume": 234189.0
    },
    {
      "date": "2026-06-15",
      "open": 658000.0,
      "high": 670000.0,
      "low": 643000.0,
      "close": 660000.0,
      "volume": 75044.0
    },
    {
      "date": "2026-06-16",
      "open": 680000.0,
      "high": 682000.0,
      "low": 610000.0,
      "close": 616000.0,
      "volume": 150265.0
    },
    {
      "date": "2026-06-17",
      "open": 629000.0,
      "high": 630000.0,
      "low": 614000.0,
      "close": 625000.0,
      "volume": 57935.0
    },
    {
      "date": "2026-06-18",
      "open": 635000.0,
      "high": 637000.0,
      "low": 603000.0,
      "close": 615000.0,
      "volume": 77337.0
    },
    {
      "date": "2026-06-19",
      "open": 608000.0,
      "high": 611000.0,
      "low": 573000.0,
      "close": 590000.0,
      "volume": 124349.0
    },
    {
      "date": "2026-06-22",
      "open": 587000.0,
      "high": 590000.0,
      "low": 563000.0,
      "close": 573000.0,
      "volume": 86658.0
    },
    {
      "date": "2026-06-23",
      "open": 565000.0,
      "high": 579000.0,
      "low": 501000.0,
      "close": 503000.0,
      "volume": 156483.0
    },
    {
      "date": "2026-06-24",
      "open": 522000.0,
      "high": 532000.0,
      "low": 501000.0,
      "close": 515000.0,
      "volume": 102908.0
    },
    {
      "date": "2026-06-25",
      "open": 530000.0,
      "high": 536000.0,
      "low": 508000.0,
      "close": 516000.0,
      "volume": 70827.0
    },
    {
      "date": "2026-06-26",
      "open": 504000.0,
      "high": 506000.0,
      "low": 467000.0,
      "close": 480000.0,
      "volume": 87042.0
    },
    {
      "date": "2026-06-29",
      "open": 481000.0,
      "high": 529000.0,
      "low": 474000.0,
      "close": 516000.0,
      "volume": 113991.0
    },
    {
      "date": "2026-06-30",
      "open": 530000.0,
      "high": 535000.0,
      "low": 500000.0,
      "close": 519000.0,
      "volume": 73209.0
    },
    {
      "date": "2026-07-01",
      "open": 519000.0,
      "high": 554000.0,
      "low": 513000.0,
      "close": 519000.0,
      "volume": 89779.0
    },
    {
      "date": "2026-07-02",
      "open": 503000.0,
      "high": 505000.0,
      "low": 477000.0,
      "close": 485000.0,
      "volume": 107266.0
    }
  ],
  "finance_symbol": "KOSDAQ:277810"
}
