{
  "schema_version": "1.0.0",
  "generator": {
    "name": "called-it",
    "version": "1.0.0",
    "commit": "15108c2"
  },
  "generated_at": "2026-10-28T06:43:08.344994Z",
  "instrument": {
    "country": "US",
    "market": "NASDAQ",
    "ticker": "UBER"
  },
  "source": "google_sheets_googfinance",
  "updated_at": "2026-10-27",
  "bars": [
    {
      "date": "2026-08-21",
      "open": 79.72,
      "high": 80.22,
      "low": 77.85,
      "close": 78.8,
      "volume": 12754344.0
    },
    {
      "date": "2026-08-24",
      "open": 79.0,
      "high": 79.52,
      "low": 77.9,
      "close": 79.29,
      "volume": 12105699.0
    },
    {
      "date": "2026-08-25",
      "open": 79.38,
      "high": 80.43,
      "low": 78.61,
      "close": 80.35,
      "volume": 14177141.0
    },
    {
      "date": "2026-08-26",
      "open": 81.56,
      "high": 82.37,
      "low": 78.42,
      "close": 78.49,
      "volume": 14523971.0
    },
    {
      "date": "2026-08-27",
      "open": 77.66,
      "high": 77.69,
      "low": 76.2,
      "close": 76.95,
      "volume": 14389122.0
    },
    {
      "date": "2026-08-28",
      "open": 77.0,
      "high": 79.0,
      "low": 76.72,
      "close": 78.82,
      "volume": 10710383.0
    },
    {
      "date": "2026-08-31",
      "open": 78.17,
      "high": 78.29,
      "low": 75.34,
      "close": 75.65,
      "volume": 18505906.0
    },
    {
      "date": "2026-09-01",
      "open": 75.27,
      "high": 76.11,
      "low": 74.62,
      "close": 75.24,
      "volume": 11220638.0
    },
    {
      "date": "2026-09-02",
      "open": 76.05,
      "high": 77.24,
      "low": 75.36,
      "close": 76.45,
      "volume": 13014668.0
    },
    {
      "date": "2026-09-03",
      "open": 77.33,
      "high": 78.35,
      "low": 75.19,
      "close": 75.96,
      "volume": 14420704.0
    },
    {
      "date": "2026-09-04",
      "open": 76.15,
      "high": 76.86,
      "low": 75.21,
      "close": 75.76,
      "volume": 14418048.0
    },
    {
      "date": "2026-09-08",
      "open": 75.61,
      "high": 75.61,
      "low": 72.72,
      "close": 73.13,
      "volume": 25922797.0
    },
    {
      "date": "2026-09-09",
      "open": 73.05,
      "high": 73.1,
      "low": 71.0,
      "close": 71.08,
      "volume": 21828780.0
    },
    {
      "date": "2026-09-10",
      "open": 70.38,
      "high": 73.48,
      "low": 69.24,
      "close": 72.56,
      "volume": 35402272.0
    },
    {
      "date": "2026-09-11",
      "open": 72.99,
      "high": 73.06,
      "low": 71.04,
      "close": 71.67,
      "volume": 25309081.0
    },
    {
      "date": "2026-09-14",
      "open": 71.97,
      "high": 72.8,
      "low": 71.26,
      "close": 72.63,
      "volume": 19054990.0
    },
    {
      "date": "2026-09-15",
      "open": 72.33,
      "high": 72.42,
      "low": 71.31,
      "close": 71.43,
      "volume": 15515817.0
    },
    {
      "date": "2026-09-16",
      "open": 71.32,
      "high": 71.96,
      "low": 70.57,
      "close": 70.97,
      "volume": 17960676.0
    },
    {
      "date": "2026-09-17",
      "open": 71.6,
      "high": 71.64,
      "low": 70.24,
      "close": 70.87,
      "volume": 19808396.0
    },
    {
      "date": "2026-09-18",
      "open": 70.9,
      "high": 71.0,
      "low": 70.06,
      "close": 70.5,
      "volume": 20652837.0
    },
    {
      "date": "2026-09-21",
      "open": 70.82,
      "high": 71.39,
      "low": 70.11,
      "close": 70.84,
      "volume": 16956051.0
    },
    {
      "date": "2026-09-22",
      "open": 71.65,
      "high": 71.9,
      "low": 69.54,
      "close": 69.89,
      "volume": 26420310.0
    },
    {
      "date": "2026-09-23",
      "open": 69.56,
      "high": 70.04,
      "low": 68.55,
      "close": 69.42,
      "volume": 18010118.0
    },
    {
      "date": "2026-09-24",
      "open": 69.45,
      "high": 70.08,
      "low": 68.93,
      "close": 69.22,
      "volume": 14479629.0
    },
    {
      "date": "2026-09-25",
      "open": 69.27,
      "high": 69.67,
      "low": 68.8,
      "close": 69.62,
      "volume": 10911598.0
    },
    {
      "date": "2026-09-28",
      "open": 69.36,
      "high": 69.68,
      "low": 67.73,
      "close": 68.16,
      "volume": 16746611.0
    },
    {
      "date": "2026-09-29",
      "open": 68.47,
      "high": 69.89,
      "low": 68.4,
      "close": 69.36,
      "volume": 14777394.0
    },
    {
      "date": "2026-09-30",
      "open": 69.9,
      "high": 69.97,
      "low": 68.5,
      "close": 68.51,
      "volume": 15629630.0
    },
    {
      "date": "2026-10-01",
      "open": 68.54,
      "high": 68.91,
      "low": 67.32,
      "close": 67.88,
      "volume": 17746837.0
    },
    {
      "date": "2026-10-02",
      "open": 68.24,
      "high": 68.47,
      "low": 67.22,
      "close": 68.11,
      "volume": 15575448.0
    },
    {
      "date": "2026-10-05",
      "open": 68.4,
      "high": 70.01,
      "low": 68.38,
      "close": 69.48,
      "volume": 17031677.0
    },
    {
      "date": "2026-10-06",
      "open": 69.56,
      "high": 69.94,
      "low": 68.76,
      "close": 69.08,
      "volume": 15066682.0
    },
    {
      "date": "2026-10-07",
      "open": 68.85,
      "high": 69.24,
      "low": 68.27,
      "close": 68.45,
      "volume": 11979488.0
    },
    {
      "date": "2026-10-08",
      "open": 68.18,
      "high": 70.32,
      "low": 68.0,
      "close": 70.24,
      "volume": 14531251.0
    },
    {
      "date": "2026-10-09",
      "open": 70.24,
      "high": 72.08,
      "low": 70.2,
      "close": 71.51,
      "volume": 16565682.0
    },
    {
      "date": "2026-10-12",
      "open": 71.16,
      "high": 71.81,
      "low": 70.04,
      "close": 71.5,
      "volume": 11762356.0
    },
    {
      "date": "2026-10-13",
      "open": 70.95,
      "high": 71.63,
      "low": 70.44,
      "close": 71.32,
      "volume": 12851735.0
    },
    {
      "date": "2026-10-14",
      "open": 70.67,
      "high": 71.25,
      "low": 68.62,
      "close": 69.29,
      "volume": 15734381.0
    },
    {
      "date": "2026-10-15",
      "open": 69.15,
      "high": 71.44,
      "low": 68.92,
      "close": 71.27,
      "volume": 14446918.0
    },
    {
      "date": "2026-10-16",
      "open": 71.0,
      "high": 71.86,
      "low": 69.72,
      "close": 70.35,
      "volume": 14484349.0
    },
    {
      "date": "2026-10-19",
      "open": 70.13,
      "high": 70.76,
      "low": 69.77,
      "close": 69.96,
      "volume": 14077217.0
    },
    {
      "date": "2026-10-20",
      "open": 69.01,
      "high": 69.75,
      "low": 68.4,
      "close": 68.94,
      "volume": 15737473.0
    },
    {
      "date": "2026-10-21",
      "open": 69.01,
      "high": 69.23,
      "low": 67.36,
      "close": 67.62,
      "volume": 16839158.0
    },
    {
      "date": "2026-10-22",
      "open": 67.45,
      "high": 69.15,
      "low": 67.33,
      "close": 69.07,
      "volume": 19328901.0
    },
    {
      "date": "2026-10-23",
      "open": 68.47,
      "high": 68.9,
      "low": 66.43,
      "close": 66.7,
      "volume": 18778177.0
    },
    {
      "date": "2026-10-26",
      "open": 66.62,
      "high": 67.0,
      "low": 65.68,
      "close": 66.13,
      "volume": 22057871.0
    },
    {
      "date": "2026-10-27",
      "open": 66.41,
      "high": 66.5,
      "low": 65.47,
      "close": 65.78,
      "volume": 20731773.0
    }
  ],
  "finance_symbol": "NYSE:UBER"
}
