{
  "schema_version": "1.0.0",
  "generator": {
    "name": "called-it",
    "version": "1.0.0",
    "commit": "5b93d7d"
  },
  "generated_at": "2026-08-04T22:55:06.491422Z",
  "instrument": {
    "country": "US",
    "market": "NASDAQ",
    "ticker": "CRWV"
  },
  "source": "google_sheets_googfinance",
  "updated_at": "2026-08-04",
  "bars": [
    {
      "date": "2026-05-14",
      "open": 111.53,
      "high": 118.21,
      "low": 110.06,
      "close": 114.22,
      "volume": 27702282.0
    },
    {
      "date": "2026-05-15",
      "open": 109.42,
      "high": 110.36,
      "low": 106.44,
      "close": 107.3,
      "volume": 22048174.0
    },
    {
      "date": "2026-05-18",
      "open": 106.79,
      "high": 106.95,
      "low": 98.65,
      "close": 103.77,
      "volume": 38653678.0
    },
    {
      "date": "2026-05-19",
      "open": 98.53,
      "high": 101.31,
      "low": 94.82,
      "close": 99.81,
      "volume": 29845564.0
    },
    {
      "date": "2026-05-20",
      "open": 101.5,
      "high": 102.75,
      "low": 98.1,
      "close": 101.28,
      "volume": 21656793.0
    },
    {
      "date": "2026-05-21",
      "open": 106.56,
      "high": 108.44,
      "low": 103.16,
      "close": 107.58,
      "volume": 31898628.0
    },
    {
      "date": "2026-05-22",
      "open": 109.32,
      "high": 109.85,
      "low": 104.88,
      "close": 105.49,
      "volume": 20001620.0
    },
    {
      "date": "2026-05-26",
      "open": 108.24,
      "high": 109.2,
      "low": 105.0,
      "close": 105.89,
      "volume": 21456078.0
    },
    {
      "date": "2026-05-27",
      "open": 105.11,
      "high": 105.55,
      "low": 99.6,
      "close": 104.27,
      "volume": 24155028.0
    },
    {
      "date": "2026-05-28",
      "open": 107.95,
      "high": 110.33,
      "low": 103.63,
      "close": 106.86,
      "volume": 23405962.0
    },
    {
      "date": "2026-05-29",
      "open": 108.02,
      "high": 110.25,
      "low": 102.3,
      "close": 109.53,
      "volume": 28158222.0
    },
    {
      "date": "2026-06-01",
      "open": 114.78,
      "high": 127.85,
      "low": 114.72,
      "close": 124.82,
      "volume": 58297282.0
    },
    {
      "date": "2026-06-02",
      "open": 129.96,
      "high": 132.15,
      "low": 118.82,
      "close": 119.27,
      "volume": 34813977.0
    },
    {
      "date": "2026-06-03",
      "open": 119.92,
      "high": 121.96,
      "low": 110.55,
      "close": 110.93,
      "volume": 26460068.0
    },
    {
      "date": "2026-06-04",
      "open": 107.49,
      "high": 110.45,
      "low": 105.03,
      "close": 108.03,
      "volume": 26751964.0
    },
    {
      "date": "2026-06-05",
      "open": 104.64,
      "high": 104.8,
      "low": 95.54,
      "close": 100.39,
      "volume": 32460769.0
    },
    {
      "date": "2026-06-08",
      "open": 102.03,
      "high": 104.3,
      "low": 98.4,
      "close": 102.37,
      "volume": 23379819.0
    },
    {
      "date": "2026-06-09",
      "open": 103.99,
      "high": 105.39,
      "low": 93.6,
      "close": 98.45,
      "volume": 26865596.0
    },
    {
      "date": "2026-06-10",
      "open": 95.39,
      "high": 100.51,
      "low": 95.1,
      "close": 95.61,
      "volume": 17855642.0
    },
    {
      "date": "2026-06-11",
      "open": 92.64,
      "high": 96.51,
      "low": 91.02,
      "close": 95.74,
      "volume": 22683488.0
    },
    {
      "date": "2026-06-12",
      "open": 99.12,
      "high": 105.55,
      "low": 97.22,
      "close": 100.55,
      "volume": 36338090.0
    },
    {
      "date": "2026-06-15",
      "open": 104.0,
      "high": 108.8,
      "low": 103.8,
      "close": 106.71,
      "volume": 22004011.0
    },
    {
      "date": "2026-06-16",
      "open": 108.3,
      "high": 119.45,
      "low": 107.62,
      "close": 117.03,
      "volume": 42823855.0
    },
    {
      "date": "2026-06-17",
      "open": 117.07,
      "high": 122.0,
      "low": 114.9,
      "close": 115.21,
      "volume": 26674228.0
    },
    {
      "date": "2026-06-18",
      "open": 118.85,
      "high": 119.89,
      "low": 114.13,
      "close": 117.95,
      "volume": 65546308.0
    },
    {
      "date": "2026-06-22",
      "open": 119.09,
      "high": 119.19,
      "low": 106.61,
      "close": 111.29,
      "volume": 29892801.0
    },
    {
      "date": "2026-06-23",
      "open": 102.93,
      "high": 112.01,
      "low": 101.96,
      "close": 105.72,
      "volume": 25319688.0
    },
    {
      "date": "2026-06-24",
      "open": 103.58,
      "high": 104.54,
      "low": 98.25,
      "close": 100.88,
      "volume": 22104304.0
    },
    {
      "date": "2026-06-25",
      "open": 105.28,
      "high": 106.54,
      "low": 98.42,
      "close": 98.76,
      "volume": 21772084.0
    },
    {
      "date": "2026-06-26",
      "open": 95.18,
      "high": 98.09,
      "low": 93.5,
      "close": 96.58,
      "volume": 46850388.0
    },
    {
      "date": "2026-06-29",
      "open": 98.38,
      "high": 98.47,
      "low": 89.55,
      "close": 95.51,
      "volume": 21976918.0
    },
    {
      "date": "2026-06-30",
      "open": 95.18,
      "high": 99.79,
      "low": 93.88,
      "close": 99.54,
      "volume": 18304891.0
    },
    {
      "date": "2026-07-01",
      "open": 88.87,
      "high": 90.26,
      "low": 85.01,
      "close": 85.69,
      "volume": 60098502.0
    },
    {
      "date": "2026-07-02",
      "open": 86.27,
      "high": 88.17,
      "low": 80.56,
      "close": 81.75,
      "volume": 32452246.0
    },
    {
      "date": "2026-07-06",
      "open": 83.02,
      "high": 87.54,
      "low": 82.5,
      "close": 86.46,
      "volume": 21929553.0
    },
    {
      "date": "2026-07-07",
      "open": 83.74,
      "high": 85.31,
      "low": 79.46,
      "close": 83.53,
      "volume": 23450281.0
    },
    {
      "date": "2026-07-08",
      "open": 82.98,
      "high": 90.15,
      "low": 82.82,
      "close": 90.0,
      "volume": 23876911.0
    },
    {
      "date": "2026-07-09",
      "open": 93.33,
      "high": 95.14,
      "low": 89.37,
      "close": 89.7,
      "volume": 24829323.0
    },
    {
      "date": "2026-07-10",
      "open": 89.89,
      "high": 91.31,
      "low": 87.93,
      "close": 88.88,
      "volume": 12714041.0
    },
    {
      "date": "2026-07-13",
      "open": 86.97,
      "high": 88.88,
      "low": 82.72,
      "close": 83.31,
      "volume": 18630081.0
    },
    {
      "date": "2026-07-14",
      "open": 84.66,
      "high": 85.91,
      "low": 78.4,
      "close": 79.94,
      "volume": 25969038.0
    },
    {
      "date": "2026-07-15",
      "open": 78.74,
      "high": 80.64,
      "low": 74.81,
      "close": 77.12,
      "volume": 24132280.0
    },
    {
      "date": "2026-07-16",
      "open": 75.57,
      "high": 75.62,
      "low": 72.08,
      "close": 72.91,
      "volume": 25032957.0
    },
    {
      "date": "2026-07-17",
      "open": 70.71,
      "high": 74.5,
      "low": 68.51,
      "close": 73.21,
      "volume": 35882634.0
    },
    {
      "date": "2026-07-20",
      "open": 75.77,
      "high": 79.31,
      "low": 73.01,
      "close": 73.06,
      "volume": 22799457.0
    },
    {
      "date": "2026-07-21",
      "open": 75.0,
      "high": 80.45,
      "low": 74.5,
      "close": 79.58,
      "volume": 24906995.0
    },
    {
      "date": "2026-07-22",
      "open": 79.89,
      "high": 85.37,
      "low": 79.58,
      "close": 82.64,
      "volume": 23467284.0
    },
    {
      "date": "2026-07-23",
      "open": 81.0,
      "high": 85.19,
      "low": 80.55,
      "close": 81.1,
      "volume": 18173672.0
    },
    {
      "date": "2026-07-24",
      "open": 79.5,
      "high": 79.57,
      "low": 71.67,
      "close": 71.88,
      "volume": 25487842.0
    },
    {
      "date": "2026-07-27",
      "open": 73.8,
      "high": 74.91,
      "low": 69.69,
      "close": 70.79,
      "volume": 17999210.0
    },
    {
      "date": "2026-07-28",
      "open": 68.97,
      "high": 69.18,
      "low": 64.63,
      "close": 67.3,
      "volume": 29855937.0
    },
    {
      "date": "2026-07-29",
      "open": 66.67,
      "high": 66.89,
      "low": 60.55,
      "close": 60.82,
      "volume": 37130113.0
    },
    {
      "date": "2026-07-30",
      "open": 68.3,
      "high": 75.87,
      "low": 67.55,
      "close": 73.9,
      "volume": 44148895.0
    },
    {
      "date": "2026-07-31",
      "open": 77.04,
      "high": 78.5,
      "low": 69.97,
      "close": 71.77,
      "volume": 26415860.0
    },
    {
      "date": "2026-08-03",
      "open": 70.56,
      "high": 86.2,
      "low": 69.89,
      "close": 85.76,
      "volume": 44016130.0
    },
    {
      "date": "2026-08-04",
      "open": 86.43,
      "high": 94.3,
      "low": 86.26,
      "close": 91.9,
      "volume": 33016477.0
    }
  ],
  "finance_symbol": "NASDAQ:CRWV"
}
