{
  "schema_version": "1.0.0",
  "generator": {
    "name": "called-it",
    "version": "1.0.0",
    "commit": "03b89d2"
  },
  "generated_at": "2026-10-29T01:26:26.252990Z",
  "instrument": {
    "country": "US",
    "market": "NASDAQ",
    "ticker": "AMZN"
  },
  "source": "google_sheets_googfinance",
  "updated_at": "2026-10-28",
  "bars": [
    {
      "date": "2026-08-18",
      "open": 260.63,
      "high": 262.18,
      "low": 257.73,
      "close": 259.45,
      "volume": 33171263.0
    },
    {
      "date": "2026-08-19",
      "open": 260.85,
      "high": 266.4,
      "low": 258.58,
      "close": 265.84,
      "volume": 35762440.0
    },
    {
      "date": "2026-08-20",
      "open": 263.16,
      "high": 263.84,
      "low": 259.52,
      "close": 260.11,
      "volume": 28374099.0
    },
    {
      "date": "2026-08-21",
      "open": 260.74,
      "high": 261.09,
      "low": 257.04,
      "close": 258.63,
      "volume": 35722956.0
    },
    {
      "date": "2026-08-24",
      "open": 259.6,
      "high": 263.32,
      "low": 259.05,
      "close": 262.07,
      "volume": 28070483.0
    },
    {
      "date": "2026-08-25",
      "open": 262.51,
      "high": 263.89,
      "low": 259.83,
      "close": 261.06,
      "volume": 25550214.0
    },
    {
      "date": "2026-08-26",
      "open": 261.27,
      "high": 262.05,
      "low": 258.24,
      "close": 260.28,
      "volume": 21528373.0
    },
    {
      "date": "2026-08-27",
      "open": 259.23,
      "high": 259.66,
      "low": 255.02,
      "close": 256.26,
      "volume": 35927808.0
    },
    {
      "date": "2026-08-28",
      "open": 258.32,
      "high": 267.56,
      "low": 257.78,
      "close": 266.43,
      "volume": 49547427.0
    },
    {
      "date": "2026-08-31",
      "open": 263.83,
      "high": 264.36,
      "low": 257.12,
      "close": 259.77,
      "volume": 46089423.0
    },
    {
      "date": "2026-09-01",
      "open": 254.83,
      "high": 255.82,
      "low": 251.93,
      "close": 254.92,
      "volume": 31700057.0
    },
    {
      "date": "2026-09-02",
      "open": 254.26,
      "high": 256.24,
      "low": 253.4,
      "close": 254.98,
      "volume": 24013335.0
    },
    {
      "date": "2026-09-03",
      "open": 256.2,
      "high": 259.5,
      "low": 256.0,
      "close": 258.9,
      "volume": 26891531.0
    },
    {
      "date": "2026-09-04",
      "open": 259.07,
      "high": 261.12,
      "low": 255.29,
      "close": 258.51,
      "volume": 30749913.0
    },
    {
      "date": "2026-09-08",
      "open": 256.68,
      "high": 257.99,
      "low": 254.75,
      "close": 256.97,
      "volume": 29397994.0
    },
    {
      "date": "2026-09-09",
      "open": 253.12,
      "high": 254.69,
      "low": 250.65,
      "close": 252.4,
      "volume": 33055487.0
    },
    {
      "date": "2026-09-10",
      "open": 250.11,
      "high": 253.15,
      "low": 249.58,
      "close": 251.89,
      "volume": 25484814.0
    },
    {
      "date": "2026-09-11",
      "open": 254.09,
      "high": 257.59,
      "low": 253.14,
      "close": 256.78,
      "volume": 26724122.0
    },
    {
      "date": "2026-09-14",
      "open": 253.15,
      "high": 255.95,
      "low": 250.74,
      "close": 253.54,
      "volume": 34352766.0
    },
    {
      "date": "2026-09-15",
      "open": 252.24,
      "high": 253.27,
      "low": 247.22,
      "close": 248.42,
      "volume": 36275442.0
    },
    {
      "date": "2026-09-16",
      "open": 248.1,
      "high": 249.26,
      "low": 244.3,
      "close": 245.96,
      "volume": 33488489.0
    },
    {
      "date": "2026-09-17",
      "open": 251.07,
      "high": 252.73,
      "low": 249.24,
      "close": 251.19,
      "volume": 30438791.0
    },
    {
      "date": "2026-09-18",
      "open": 252.92,
      "high": 255.43,
      "low": 251.88,
      "close": 253.71,
      "volume": 52274714.0
    },
    {
      "date": "2026-09-21",
      "open": 256.4,
      "high": 259.49,
      "low": 253.6,
      "close": 258.45,
      "volume": 42979407.0
    },
    {
      "date": "2026-09-22",
      "open": 255.11,
      "high": 259.0,
      "low": 253.78,
      "close": 254.98,
      "volume": 41982570.0
    },
    {
      "date": "2026-09-23",
      "open": 253.0,
      "high": 253.99,
      "low": 247.76,
      "close": 249.27,
      "volume": 44209158.0
    },
    {
      "date": "2026-09-24",
      "open": 246.02,
      "high": 250.43,
      "low": 245.6,
      "close": 249.38,
      "volume": 33040053.0
    },
    {
      "date": "2026-09-25",
      "open": 248.56,
      "high": 250.88,
      "low": 247.18,
      "close": 249.67,
      "volume": 34263902.0
    },
    {
      "date": "2026-09-28",
      "open": 246.63,
      "high": 247.77,
      "low": 244.73,
      "close": 246.15,
      "volume": 32596710.0
    },
    {
      "date": "2026-09-29",
      "open": 246.71,
      "high": 248.84,
      "low": 245.14,
      "close": 246.67,
      "volume": 33730402.0
    },
    {
      "date": "2026-09-30",
      "open": 246.79,
      "high": 252.44,
      "low": 246.08,
      "close": 249.15,
      "volume": 41913111.0
    },
    {
      "date": "2026-10-01",
      "open": 251.61,
      "high": 251.83,
      "low": 246.12,
      "close": 248.23,
      "volume": 33243918.0
    },
    {
      "date": "2026-10-02",
      "open": 251.51,
      "high": 253.56,
      "low": 250.02,
      "close": 251.52,
      "volume": 33433392.0
    },
    {
      "date": "2026-10-05",
      "open": 250.19,
      "high": 254.53,
      "low": 250.18,
      "close": 251.4,
      "volume": 39273944.0
    },
    {
      "date": "2026-10-06",
      "open": 253.4,
      "high": 256.68,
      "low": 251.08,
      "close": 256.29,
      "volume": 34120787.0
    },
    {
      "date": "2026-10-07",
      "open": 254.23,
      "high": 260.14,
      "low": 253.17,
      "close": 259.92,
      "volume": 36225814.0
    },
    {
      "date": "2026-10-08",
      "open": 259.74,
      "high": 259.86,
      "low": 253.78,
      "close": 254.06,
      "volume": 38649939.0
    },
    {
      "date": "2026-10-09",
      "open": 256.5,
      "high": 262.8,
      "low": 256.0,
      "close": 262.43,
      "volume": 34770000.0
    },
    {
      "date": "2026-10-12",
      "open": 262.5,
      "high": 263.7,
      "low": 259.27,
      "close": 259.53,
      "volume": 26577897.0
    },
    {
      "date": "2026-10-13",
      "open": 259.44,
      "high": 262.83,
      "low": 258.42,
      "close": 258.58,
      "volume": 25299541.0
    },
    {
      "date": "2026-10-14",
      "open": 258.01,
      "high": 259.65,
      "low": 252.66,
      "close": 254.08,
      "volume": 34821021.0
    },
    {
      "date": "2026-10-15",
      "open": 250.89,
      "high": 255.6,
      "low": 248.65,
      "close": 254.76,
      "volume": 34564193.0
    },
    {
      "date": "2026-10-16",
      "open": 255.1,
      "high": 255.54,
      "low": 248.6,
      "close": 250.0,
      "volume": 40427342.0
    },
    {
      "date": "2026-10-19",
      "open": 255.25,
      "high": 263.72,
      "low": 255.22,
      "close": 262.45,
      "volume": 56188776.0
    },
    {
      "date": "2026-10-20",
      "open": 264.08,
      "high": 265.34,
      "low": 260.42,
      "close": 262.63,
      "volume": 34927210.0
    },
    {
      "date": "2026-10-21",
      "open": 262.71,
      "high": 264.36,
      "low": 259.29,
      "close": 262.37,
      "volume": 31214698.0
    },
    {
      "date": "2026-10-22",
      "open": 258.18,
      "high": 258.41,
      "low": 248.0,
      "close": 250.38,
      "volume": 48814021.0
    },
    {
      "date": "2026-10-23",
      "open": 248.85,
      "high": 250.01,
      "low": 246.45,
      "close": 248.0,
      "volume": 25569043.0
    },
    {
      "date": "2026-10-26",
      "open": 249.47,
      "high": 250.79,
      "low": 247.23,
      "close": 249.09,
      "volume": 32696380.0
    },
    {
      "date": "2026-10-27",
      "open": 250.43,
      "high": 254.68,
      "low": 248.71,
      "close": 253.1,
      "volume": 34477821.0
    },
    {
      "date": "2026-10-28",
      "open": 253.0,
      "high": 255.36,
      "low": 251.98,
      "close": 254.6,
      "volume": 33196770.0
    }
  ],
  "finance_symbol": "NASDAQ:AMZN"
}
