{
  "schema_version": "1.0.0",
  "generator": {
    "name": "called-it",
    "version": "1.0.0",
    "commit": "1ad33c3"
  },
  "generated_at": "2026-08-27T02:27:57.769057Z",
  "instrument": {
    "country": "US",
    "market": "NASDAQ",
    "ticker": "META"
  },
  "source": "google_sheets_googfinance",
  "updated_at": "2026-08-26",
  "bars": [
    {
      "date": "2026-08-18",
      "open": 557.48,
      "high": 560.66,
      "low": 543.21,
      "close": 543.67,
      "volume": 27094871.0
    },
    {
      "date": "2026-08-19",
      "open": 541.34,
      "high": 554.07,
      "low": 537.27,
      "close": 546.03,
      "volume": 16971740.0
    },
    {
      "date": "2026-08-20",
      "open": 546.95,
      "high": 549.99,
      "low": 539.31,
      "close": 545.83,
      "volume": 13872173.0
    },
    {
      "date": "2026-08-21",
      "open": 546.89,
      "high": 553.87,
      "low": 543.23,
      "close": 549.9,
      "volume": 13848015.0
    },
    {
      "date": "2026-08-24",
      "open": 550.2,
      "high": 561.42,
      "low": 546.3,
      "close": 559.02,
      "volume": 12990583.0
    },
    {
      "date": "2026-08-25",
      "open": 563.88,
      "high": 570.8,
      "low": 561.4,
      "close": 570.05,
      "volume": 9647917.0
    },
    {
      "date": "2026-08-26",
      "open": 590.31,
      "high": 593.34,
      "low": 561.88,
      "close": 576.14,
      "volume": 31112823.0
    }
  ],
  "finance_symbol": "NASDAQ:META"
}
