{
  "schema_version": "1.0.0",
  "generator": {
    "name": "called-it",
    "version": "1.0.0",
    "commit": "7942831"
  },
  "generated_at": "2026-07-10T04:58:08.271766Z",
  "instrument": {
    "country": "US",
    "market": "NASDAQ",
    "ticker": "LITE"
  },
  "source": "google_sheets_googfinance",
  "updated_at": "2026-07-09",
  "bars": [
    {
      "date": "2026-04-27",
      "open": 855.75,
      "high": 867.85,
      "low": 811.45,
      "close": 859.68,
      "volume": 5289749.0
    },
    {
      "date": "2026-04-28",
      "open": 813.74,
      "high": 842.0,
      "low": 780.48,
      "close": 791.37,
      "volume": 5547735.0
    },
    {
      "date": "2026-04-29",
      "open": 821.11,
      "high": 887.9,
      "low": 814.19,
      "close": 858.32,
      "volume": 6179936.0
    },
    {
      "date": "2026-04-30",
      "open": 895.17,
      "high": 921.37,
      "low": 856.0,
      "close": 902.32,
      "volume": 6148458.0
    },
    {
      "date": "2026-05-01",
      "open": 913.0,
      "high": 985.13,
      "low": 905.7,
      "close": 949.93,
      "volume": 4774684.0
    },
    {
      "date": "2026-05-04",
      "open": 986.88,
      "high": 1004.94,
      "low": 952.0,
      "close": 976.18,
      "volume": 5445773.0
    },
    {
      "date": "2026-05-05",
      "open": 975.83,
      "high": 1021.0,
      "low": 966.06,
      "close": 994.56,
      "volume": 6588139.0
    },
    {
      "date": "2026-05-06",
      "open": 996.0,
      "high": 1013.5,
      "low": 902.01,
      "close": 944.28,
      "volume": 9902076.0
    },
    {
      "date": "2026-05-07",
      "open": 915.98,
      "high": 918.02,
      "low": 854.62,
      "close": 892.58,
      "volume": 7268188.0
    },
    {
      "date": "2026-05-08",
      "open": 917.0,
      "high": 934.92,
      "low": 866.0,
      "close": 903.8,
      "volume": 6727632.0
    },
    {
      "date": "2026-05-11",
      "open": 949.72,
      "high": 1073.33,
      "low": 949.45,
      "close": 1053.09,
      "volume": 9550934.0
    },
    {
      "date": "2026-05-12",
      "open": 1018.23,
      "high": 1085.68,
      "low": 937.64,
      "close": 992.37,
      "volume": 7562654.0
    },
    {
      "date": "2026-05-13",
      "open": 1051.59,
      "high": 1062.1,
      "low": 998.2,
      "close": 1030.37,
      "volume": 4398495.0
    },
    {
      "date": "2026-05-14",
      "open": 1002.0,
      "high": 1024.85,
      "low": 983.02,
      "close": 1001.81,
      "volume": 3557117.0
    },
    {
      "date": "2026-05-15",
      "open": 941.6,
      "high": 987.85,
      "low": 923.0,
      "close": 970.7,
      "volume": 10141821.0
    },
    {
      "date": "2026-05-18",
      "open": 953.3,
      "high": 954.26,
      "low": 857.0,
      "close": 884.98,
      "volume": 7197455.0
    },
    {
      "date": "2026-05-19",
      "open": 873.17,
      "high": 910.0,
      "low": 845.0,
      "close": 890.09,
      "volume": 5025757.0
    },
    {
      "date": "2026-05-20",
      "open": 917.01,
      "high": 929.26,
      "low": 856.23,
      "close": 868.07,
      "volume": 5195010.0
    },
    {
      "date": "2026-05-21",
      "open": 869.8,
      "high": 977.27,
      "low": 859.0,
      "close": 964.5,
      "volume": 5781946.0
    },
    {
      "date": "2026-05-22",
      "open": 965.15,
      "high": 971.05,
      "low": 934.85,
      "close": 946.9,
      "volume": 3076888.0
    },
    {
      "date": "2026-05-26",
      "open": 963.01,
      "high": 963.01,
      "low": 903.02,
      "close": 910.81,
      "volume": 5212246.0
    },
    {
      "date": "2026-05-27",
      "open": 901.55,
      "high": 915.0,
      "low": 858.0,
      "close": 902.31,
      "volume": 4236050.0
    },
    {
      "date": "2026-05-28",
      "open": 936.7,
      "high": 948.49,
      "low": 854.52,
      "close": 860.62,
      "volume": 6128612.0
    },
    {
      "date": "2026-05-29",
      "open": 860.68,
      "high": 869.0,
      "low": 822.5,
      "close": 854.96,
      "volume": 6363965.0
    },
    {
      "date": "2026-06-01",
      "open": 825.25,
      "high": 931.85,
      "low": 806.62,
      "close": 905.0,
      "volume": 7932745.0
    },
    {
      "date": "2026-06-02",
      "open": 935.13,
      "high": 1035.0,
      "low": 935.01,
      "close": 1029.15,
      "volume": 8154612.0
    },
    {
      "date": "2026-06-03",
      "open": 1029.08,
      "high": 1049.53,
      "low": 932.5,
      "close": 938.0,
      "volume": 6202152.0
    },
    {
      "date": "2026-06-04",
      "open": 900.1,
      "high": 955.48,
      "low": 864.2,
      "close": 945.08,
      "volume": 6060884.0
    },
    {
      "date": "2026-06-05",
      "open": 912.62,
      "high": 974.0,
      "low": 853.1,
      "close": 863.66,
      "volume": 7543934.0
    },
    {
      "date": "2026-06-08",
      "open": 899.79,
      "high": 914.0,
      "low": 841.93,
      "close": 895.4,
      "volume": 5097079.0
    },
    {
      "date": "2026-06-09",
      "open": 908.12,
      "high": 914.0,
      "low": 776.01,
      "close": 821.76,
      "volume": 7966067.0
    },
    {
      "date": "2026-06-10",
      "open": 833.7,
      "high": 884.18,
      "low": 825.66,
      "close": 853.26,
      "volume": 5839496.0
    },
    {
      "date": "2026-06-11",
      "open": 863.0,
      "high": 890.8,
      "low": 840.52,
      "close": 889.59,
      "volume": 4672236.0
    },
    {
      "date": "2026-06-12",
      "open": 889.43,
      "high": 934.26,
      "low": 863.0,
      "close": 921.56,
      "volume": 4563159.0
    },
    {
      "date": "2026-06-15",
      "open": 965.98,
      "high": 998.5,
      "low": 923.95,
      "close": 957.24,
      "volume": 5266081.0
    },
    {
      "date": "2026-06-16",
      "open": 958.48,
      "high": 961.68,
      "low": 863.41,
      "close": 875.36,
      "volume": 6070808.0
    },
    {
      "date": "2026-06-17",
      "open": 879.08,
      "high": 891.55,
      "low": 853.78,
      "close": 869.98,
      "volume": 5148178.0
    },
    {
      "date": "2026-06-18",
      "open": 881.98,
      "high": 888.54,
      "low": 831.17,
      "close": 850.0,
      "volume": 8360832.0
    },
    {
      "date": "2026-06-22",
      "open": 852.52,
      "high": 906.18,
      "low": 829.0,
      "close": 893.93,
      "volume": 6909894.0
    },
    {
      "date": "2026-06-23",
      "open": 832.15,
      "high": 856.6,
      "low": 812.8,
      "close": 827.92,
      "volume": 4817064.0
    },
    {
      "date": "2026-06-24",
      "open": 825.0,
      "high": 866.43,
      "low": 803.24,
      "close": 842.53,
      "volume": 4452727.0
    },
    {
      "date": "2026-06-25",
      "open": 887.25,
      "high": 899.53,
      "low": 810.24,
      "close": 861.97,
      "volume": 4529350.0
    },
    {
      "date": "2026-06-26",
      "open": 822.55,
      "high": 824.86,
      "low": 774.3,
      "close": 816.98,
      "volume": 9023137.0
    },
    {
      "date": "2026-06-29",
      "open": 806.01,
      "high": 852.78,
      "low": 754.0,
      "close": 851.4,
      "volume": 5604162.0
    },
    {
      "date": "2026-06-30",
      "open": 844.03,
      "high": 874.86,
      "low": 838.11,
      "close": 858.06,
      "volume": 4172091.0
    },
    {
      "date": "2026-07-01",
      "open": 818.41,
      "high": 841.26,
      "low": 784.0,
      "close": 801.16,
      "volume": 4107980.0
    },
    {
      "date": "2026-07-02",
      "open": 777.58,
      "high": 803.9,
      "low": 710.01,
      "close": 728.32,
      "volume": 5176501.0
    },
    {
      "date": "2026-07-06",
      "open": 729.0,
      "high": 747.0,
      "low": 716.13,
      "close": 731.25,
      "volume": 3805531.0
    },
    {
      "date": "2026-07-07",
      "open": 699.42,
      "high": 732.57,
      "low": 680.43,
      "close": 698.91,
      "volume": 3750797.0
    },
    {
      "date": "2026-07-08",
      "open": 688.9,
      "high": 719.12,
      "low": 683.4,
      "close": 707.1,
      "volume": 2586225.0
    },
    {
      "date": "2026-07-09",
      "open": 755.16,
      "high": 804.9,
      "low": 751.9,
      "close": 785.77,
      "volume": 5451526.0
    }
  ],
  "finance_symbol": "NASDAQ:LITE"
}
