{
  "schema_version": "1.0.0",
  "generator": {
    "name": "called-it",
    "version": "1.0.0",
    "commit": "2089cf8"
  },
  "generated_at": "2026-07-30T22:58:30.661541Z",
  "instrument": {
    "country": "US",
    "market": "NASDAQ",
    "ticker": "SPIR"
  },
  "source": "google_sheets_googfinance",
  "updated_at": "2026-07-30",
  "bars": [
    {
      "date": "2026-05-27",
      "open": 24.53,
      "high": 25.93,
      "low": 23.2,
      "close": 25.48,
      "volume": 2907522.0
    },
    {
      "date": "2026-05-28",
      "open": 25.0,
      "high": 25.3,
      "low": 22.93,
      "close": 24.1,
      "volume": 1599403.0
    },
    {
      "date": "2026-05-29",
      "open": 23.37,
      "high": 23.58,
      "low": 21.73,
      "close": 22.84,
      "volume": 1344895.0
    },
    {
      "date": "2026-06-01",
      "open": 22.04,
      "high": 22.45,
      "low": 20.06,
      "close": 20.56,
      "volume": 1587601.0
    },
    {
      "date": "2026-06-02",
      "open": 20.85,
      "high": 21.97,
      "low": 20.45,
      "close": 21.35,
      "volume": 1209408.0
    },
    {
      "date": "2026-06-03",
      "open": 21.0,
      "high": 21.37,
      "low": 18.52,
      "close": 19.04,
      "volume": 1378973.0
    },
    {
      "date": "2026-06-04",
      "open": 19.3,
      "high": 21.57,
      "low": 18.96,
      "close": 20.04,
      "volume": 1671733.0
    },
    {
      "date": "2026-06-05",
      "open": 19.98,
      "high": 19.98,
      "low": 16.94,
      "close": 17.16,
      "volume": 1405057.0
    },
    {
      "date": "2026-06-08",
      "open": 17.82,
      "high": 18.19,
      "low": 16.88,
      "close": 17.02,
      "volume": 1009330.0
    },
    {
      "date": "2026-06-09",
      "open": 17.03,
      "high": 17.4,
      "low": 15.3,
      "close": 16.26,
      "volume": 1592971.0
    },
    {
      "date": "2026-06-10",
      "open": 16.34,
      "high": 17.08,
      "low": 16.01,
      "close": 16.37,
      "volume": 737129.0
    },
    {
      "date": "2026-06-11",
      "open": 16.74,
      "high": 19.98,
      "low": 16.65,
      "close": 19.79,
      "volume": 2295635.0
    },
    {
      "date": "2026-06-12",
      "open": 19.32,
      "high": 20.15,
      "low": 17.49,
      "close": 18.23,
      "volume": 1590048.0
    },
    {
      "date": "2026-06-15",
      "open": 19.25,
      "high": 19.25,
      "low": 17.76,
      "close": 18.44,
      "volume": 1383948.0
    },
    {
      "date": "2026-06-16",
      "open": 18.14,
      "high": 18.5,
      "low": 17.12,
      "close": 17.15,
      "volume": 1225555.0
    },
    {
      "date": "2026-06-17",
      "open": 17.58,
      "high": 18.96,
      "low": 17.12,
      "close": 18.15,
      "volume": 1123498.0
    },
    {
      "date": "2026-06-18",
      "open": 18.53,
      "high": 19.12,
      "low": 16.91,
      "close": 18.97,
      "volume": 5465801.0
    },
    {
      "date": "2026-06-22",
      "open": 18.6,
      "high": 18.9,
      "low": 16.54,
      "close": 17.27,
      "volume": 1953683.0
    },
    {
      "date": "2026-06-23",
      "open": 16.95,
      "high": 18.6,
      "low": 16.95,
      "close": 17.44,
      "volume": 1018794.0
    },
    {
      "date": "2026-06-24",
      "open": 17.3,
      "high": 17.68,
      "low": 16.75,
      "close": 17.13,
      "volume": 743616.0
    },
    {
      "date": "2026-06-25",
      "open": 17.01,
      "high": 17.27,
      "low": 15.93,
      "close": 15.99,
      "volume": 862313.0
    },
    {
      "date": "2026-06-26",
      "open": 15.65,
      "high": 16.56,
      "low": 15.5,
      "close": 16.29,
      "volume": 1582979.0
    },
    {
      "date": "2026-06-29",
      "open": 17.19,
      "high": 17.9,
      "low": 16.47,
      "close": 17.65,
      "volume": 1243993.0
    },
    {
      "date": "2026-06-30",
      "open": 17.56,
      "high": 18.69,
      "low": 17.45,
      "close": 18.6,
      "volume": 847378.0
    },
    {
      "date": "2026-07-01",
      "open": 18.55,
      "high": 20.2,
      "low": 18.35,
      "close": 18.38,
      "volume": 909698.0
    },
    {
      "date": "2026-07-02",
      "open": 18.23,
      "high": 19.68,
      "low": 17.96,
      "close": 18.44,
      "volume": 975568.0
    },
    {
      "date": "2026-07-06",
      "open": 18.25,
      "high": 18.71,
      "low": 17.32,
      "close": 17.65,
      "volume": 579510.0
    },
    {
      "date": "2026-07-07",
      "open": 17.35,
      "high": 17.55,
      "low": 16.5,
      "close": 16.84,
      "volume": 897466.0
    },
    {
      "date": "2026-07-08",
      "open": 16.72,
      "high": 17.54,
      "low": 15.96,
      "close": 16.25,
      "volume": 526483.0
    },
    {
      "date": "2026-07-09",
      "open": 16.58,
      "high": 16.81,
      "low": 15.95,
      "close": 16.04,
      "volume": 695921.0
    },
    {
      "date": "2026-07-10",
      "open": 16.12,
      "high": 16.12,
      "low": 14.64,
      "close": 14.7,
      "volume": 1187587.0
    },
    {
      "date": "2026-07-13",
      "open": 14.52,
      "high": 14.87,
      "low": 13.86,
      "close": 13.99,
      "volume": 1267583.0
    },
    {
      "date": "2026-07-14",
      "open": 14.27,
      "high": 15.11,
      "low": 14.02,
      "close": 14.5,
      "volume": 620673.0
    },
    {
      "date": "2026-07-15",
      "open": 14.42,
      "high": 14.92,
      "low": 13.62,
      "close": 13.63,
      "volume": 834681.0
    },
    {
      "date": "2026-07-16",
      "open": 13.25,
      "high": 13.5,
      "low": 12.0,
      "close": 12.15,
      "volume": 1713132.0
    },
    {
      "date": "2026-07-17",
      "open": 11.87,
      "high": 12.44,
      "low": 11.61,
      "close": 12.14,
      "volume": 894363.0
    },
    {
      "date": "2026-07-20",
      "open": 11.84,
      "high": 12.14,
      "low": 10.88,
      "close": 10.96,
      "volume": 2066243.0
    },
    {
      "date": "2026-07-21",
      "open": 11.06,
      "high": 11.74,
      "low": 11.06,
      "close": 11.66,
      "volume": 1209133.0
    },
    {
      "date": "2026-07-22",
      "open": 11.49,
      "high": 11.91,
      "low": 11.34,
      "close": 11.43,
      "volume": 603551.0
    },
    {
      "date": "2026-07-23",
      "open": 11.37,
      "high": 11.73,
      "low": 11.18,
      "close": 11.53,
      "volume": 422993.0
    },
    {
      "date": "2026-07-24",
      "open": 11.56,
      "high": 11.6,
      "low": 10.93,
      "close": 10.99,
      "volume": 479984.0
    },
    {
      "date": "2026-07-27",
      "open": 11.11,
      "high": 11.66,
      "low": 10.85,
      "close": 11.17,
      "volume": 510569.0
    },
    {
      "date": "2026-07-28",
      "open": 11.0,
      "high": 11.37,
      "low": 10.52,
      "close": 11.37,
      "volume": 692696.0
    },
    {
      "date": "2026-07-29",
      "open": 11.15,
      "high": 11.3,
      "low": 10.44,
      "close": 10.54,
      "volume": 638083.0
    },
    {
      "date": "2026-07-30",
      "open": 11.05,
      "high": 11.8,
      "low": 10.91,
      "close": 11.36,
      "volume": 479832.0
    }
  ],
  "finance_symbol": "NYSE:SPIR"
}
