{
  "schema_version": "1.0.0",
  "generator": {
    "name": "called-it",
    "version": "1.0.0",
    "commit": "35498fb"
  },
  "generated_at": "2026-07-22T22:56:14.267350Z",
  "instrument": {
    "country": "US",
    "market": "NASDAQ",
    "ticker": "CRCL"
  },
  "source": "google_sheets_googfinance",
  "updated_at": "2026-07-22",
  "bars": [
    {
      "date": "2026-05-12",
      "open": 129.99,
      "high": 140.0,
      "low": 120.5,
      "close": 123.65,
      "volume": 29501803.0
    },
    {
      "date": "2026-05-13",
      "open": 125.73,
      "high": 130.73,
      "low": 118.2,
      "close": 126.57,
      "volume": 19433416.0
    },
    {
      "date": "2026-05-14",
      "open": 123.6,
      "high": 132.44,
      "low": 118.36,
      "close": 123.88,
      "volume": 23591996.0
    },
    {
      "date": "2026-05-15",
      "open": 117.47,
      "high": 118.26,
      "low": 111.39,
      "close": 114.0,
      "volume": 17958161.0
    },
    {
      "date": "2026-05-18",
      "open": 112.1,
      "high": 114.78,
      "low": 107.21,
      "close": 111.39,
      "volume": 12562856.0
    },
    {
      "date": "2026-05-19",
      "open": 109.2,
      "high": 115.36,
      "low": 108.67,
      "close": 111.03,
      "volume": 10704677.0
    },
    {
      "date": "2026-05-20",
      "open": 111.37,
      "high": 113.48,
      "low": 109.06,
      "close": 111.62,
      "volume": 7009811.0
    },
    {
      "date": "2026-05-21",
      "open": 111.04,
      "high": 117.94,
      "low": 110.43,
      "close": 114.88,
      "volume": 10864696.0
    },
    {
      "date": "2026-05-22",
      "open": 116.12,
      "high": 118.85,
      "low": 112.2,
      "close": 113.12,
      "volume": 9796023.0
    },
    {
      "date": "2026-05-26",
      "open": 112.22,
      "high": 113.04,
      "low": 104.14,
      "close": 104.17,
      "volume": 15862287.0
    },
    {
      "date": "2026-05-27",
      "open": 103.0,
      "high": 106.6,
      "low": 102.33,
      "close": 102.64,
      "volume": 8300661.0
    },
    {
      "date": "2026-05-28",
      "open": 101.44,
      "high": 108.38,
      "low": 97.69,
      "close": 108.24,
      "volume": 11835345.0
    },
    {
      "date": "2026-05-29",
      "open": 108.03,
      "high": 114.44,
      "low": 106.75,
      "close": 113.0,
      "volume": 24738859.0
    },
    {
      "date": "2026-06-01",
      "open": 108.38,
      "high": 109.5,
      "low": 104.26,
      "close": 104.97,
      "volume": 14307316.0
    },
    {
      "date": "2026-06-02",
      "open": 101.88,
      "high": 103.77,
      "low": 98.55,
      "close": 100.85,
      "volume": 14601265.0
    },
    {
      "date": "2026-06-03",
      "open": 99.18,
      "high": 99.18,
      "low": 90.13,
      "close": 90.13,
      "volume": 16370841.0
    },
    {
      "date": "2026-06-04",
      "open": 90.89,
      "high": 95.18,
      "low": 89.2,
      "close": 90.54,
      "volume": 12226827.0
    },
    {
      "date": "2026-06-05",
      "open": 88.11,
      "high": 88.11,
      "low": 78.41,
      "close": 80.28,
      "volume": 24729291.0
    },
    {
      "date": "2026-06-08",
      "open": 84.01,
      "high": 84.13,
      "low": 81.4,
      "close": 82.53,
      "volume": 10609374.0
    },
    {
      "date": "2026-06-09",
      "open": 81.17,
      "high": 87.38,
      "low": 77.87,
      "close": 81.1,
      "volume": 13527302.0
    },
    {
      "date": "2026-06-10",
      "open": 78.93,
      "high": 84.3,
      "low": 78.6,
      "close": 78.93,
      "volume": 8420756.0
    },
    {
      "date": "2026-06-11",
      "open": 79.5,
      "high": 83.91,
      "low": 78.61,
      "close": 82.63,
      "volume": 8856759.0
    },
    {
      "date": "2026-06-12",
      "open": 82.01,
      "high": 82.05,
      "low": 77.61,
      "close": 77.84,
      "volume": 12394325.0
    },
    {
      "date": "2026-06-15",
      "open": 82.89,
      "high": 87.3,
      "low": 82.41,
      "close": 83.37,
      "volume": 15478955.0
    },
    {
      "date": "2026-06-16",
      "open": 82.5,
      "high": 82.92,
      "low": 78.71,
      "close": 79.72,
      "volume": 9859941.0
    },
    {
      "date": "2026-06-17",
      "open": 79.1,
      "high": 85.24,
      "low": 78.5,
      "close": 80.59,
      "volume": 9891111.0
    },
    {
      "date": "2026-06-18",
      "open": 80.28,
      "high": 81.4,
      "low": 76.84,
      "close": 80.23,
      "volume": 14862986.0
    },
    {
      "date": "2026-06-22",
      "open": 81.25,
      "high": 84.86,
      "low": 78.97,
      "close": 79.95,
      "volume": 9694456.0
    },
    {
      "date": "2026-06-23",
      "open": 76.11,
      "high": 78.22,
      "low": 74.7,
      "close": 75.68,
      "volume": 8875095.0
    },
    {
      "date": "2026-06-24",
      "open": 75.6,
      "high": 75.6,
      "low": 70.07,
      "close": 70.98,
      "volume": 11283555.0
    },
    {
      "date": "2026-06-25",
      "open": 71.3,
      "high": 71.57,
      "low": 67.51,
      "close": 68.81,
      "volume": 10894721.0
    },
    {
      "date": "2026-06-26",
      "open": 67.92,
      "high": 74.45,
      "low": 67.36,
      "close": 73.57,
      "volume": 14419026.0
    },
    {
      "date": "2026-06-29",
      "open": 75.18,
      "high": 76.15,
      "low": 72.39,
      "close": 75.96,
      "volume": 9184716.0
    },
    {
      "date": "2026-06-30",
      "open": 72.25,
      "high": 73.2,
      "low": 62.52,
      "close": 62.63,
      "volume": 37097145.0
    },
    {
      "date": "2026-07-01",
      "open": 63.71,
      "high": 66.25,
      "low": 61.77,
      "close": 61.95,
      "volume": 24273148.0
    },
    {
      "date": "2026-07-02",
      "open": 63.81,
      "high": 69.25,
      "low": 63.66,
      "close": 64.62,
      "volume": 17564629.0
    },
    {
      "date": "2026-07-06",
      "open": 64.56,
      "high": 69.98,
      "low": 62.95,
      "close": 68.65,
      "volume": 13085912.0
    },
    {
      "date": "2026-07-07",
      "open": 67.75,
      "high": 69.05,
      "low": 64.58,
      "close": 65.15,
      "volume": 8443835.0
    },
    {
      "date": "2026-07-08",
      "open": 64.19,
      "high": 64.48,
      "low": 61.88,
      "close": 64.07,
      "volume": 8525616.0
    },
    {
      "date": "2026-07-09",
      "open": 62.95,
      "high": 64.8,
      "low": 61.67,
      "close": 63.01,
      "volume": 9366304.0
    },
    {
      "date": "2026-07-10",
      "open": 70.6,
      "high": 72.86,
      "low": 65.07,
      "close": 66.14,
      "volume": 36802133.0
    },
    {
      "date": "2026-07-13",
      "open": 64.42,
      "high": 66.1,
      "low": 62.36,
      "close": 63.0,
      "volume": 12888805.0
    },
    {
      "date": "2026-07-14",
      "open": 61.66,
      "high": 63.49,
      "low": 59.29,
      "close": 63.22,
      "volume": 15796898.0
    },
    {
      "date": "2026-07-15",
      "open": 64.46,
      "high": 66.85,
      "low": 63.25,
      "close": 65.69,
      "volume": 12928255.0
    },
    {
      "date": "2026-07-16",
      "open": 64.43,
      "high": 64.9,
      "low": 60.36,
      "close": 60.64,
      "volume": 9798148.0
    },
    {
      "date": "2026-07-17",
      "open": 59.18,
      "high": 62.4,
      "low": 58.68,
      "close": 60.46,
      "volume": 8757976.0
    },
    {
      "date": "2026-07-20",
      "open": 60.95,
      "high": 66.98,
      "low": 60.87,
      "close": 65.45,
      "volume": 13867083.0
    },
    {
      "date": "2026-07-21",
      "open": 68.94,
      "high": 72.68,
      "low": 68.65,
      "close": 71.08,
      "volume": 18049037.0
    },
    {
      "date": "2026-07-22",
      "open": 67.95,
      "high": 70.23,
      "low": 65.35,
      "close": 66.16,
      "volume": 10682850.0
    }
  ],
  "finance_symbol": "NYSE:CRCL"
}
