{
  "schema_version": "1.0.0",
  "generator": {
    "name": "called-it",
    "version": "1.0.0",
    "commit": "587c74e"
  },
  "generated_at": "2026-07-02T22:59:24.082348Z",
  "instrument": {
    "country": "US",
    "market": "NASDAQ",
    "ticker": "BTQ"
  },
  "source": "google_sheets_googfinance",
  "updated_at": "2026-07-02",
  "bars": [
    {
      "date": "2026-06-22",
      "open": 5.05,
      "high": 5.15,
      "low": 4.26,
      "close": 4.44,
      "volume": 10283563.0
    },
    {
      "date": "2026-06-23",
      "open": 4.48,
      "high": 5.89,
      "low": 4.47,
      "close": 5.87,
      "volume": 14477580.0
    },
    {
      "date": "2026-06-24",
      "open": 5.75,
      "high": 5.79,
      "low": 5.28,
      "close": 5.51,
      "volume": 4690546.0
    },
    {
      "date": "2026-06-25",
      "open": 5.61,
      "high": 5.68,
      "low": 5.07,
      "close": 5.42,
      "volume": 3351752.0
    },
    {
      "date": "2026-06-26",
      "open": 5.06,
      "high": 5.38,
      "low": 5.01,
      "close": 5.15,
      "volume": 2745485.0
    },
    {
      "date": "2026-06-29",
      "open": 5.33,
      "high": 5.71,
      "low": 5.15,
      "close": 5.57,
      "volume": 3120530.0
    },
    {
      "date": "2026-06-30",
      "open": 5.5,
      "high": 5.74,
      "low": 5.27,
      "close": 5.39,
      "volume": 3138618.0
    },
    {
      "date": "2026-07-01",
      "open": 5.24,
      "high": 5.67,
      "low": 5.16,
      "close": 5.33,
      "volume": 3531045.0
    },
    {
      "date": "2026-07-02",
      "open": 5.36,
      "high": 5.58,
      "low": 4.76,
      "close": 4.81,
      "volume": 3457012.0
    }
  ],
  "finance_symbol": "NASDAQ:BTQ"
}
